{
  "id": "rel-aipac-pac-2024",
  "from": "AIPAC Political Action Committee",
  "to": "US federal candidates",
  "type": "political_spending",
  "description": "Receipts of $57.9 million and disbursements of $57.4 million in the 2024 cycle. Most money is raised from donors and passed through to candidates as earmarked contributions.",
  "period": "2023-2024 cycle",
  "amount_usd": 57417825.13,
  "what_it_does_not_show": "Disbursements include earmarked donor contributions passed to campaigns; check the FEC itemized filings before calling this AIPAC's own money.",
  "confidence": "high",
  "label": "established_fact",
  "sources": [
    {
      "url": "https://www.fec.gov/data/committee/C00797670/?cycle=2024",
      "publisher": "Federal Election Commission",
      "published_at": null,
      "accessed_at": "2026-10-18",
      "kind": "primary"
    }
  ]
}
