{
  "id": "rel-aipac-pac-2026",
  "from": "AIPAC Political Action Committee",
  "to": "US federal candidates",
  "type": "political_spending",
  "description": "Receipts of $52.3 million and disbursements of $50.5 million in the 2026 cycle through August 31, 2026.",
  "period": "2025-2026 cycle, through 2026-08-31",
  "amount_usd": 50496735.5,
  "what_it_does_not_show": "Partial cycle.",
  "confidence": "high",
  "label": "established_fact",
  "sources": [
    {
      "url": "https://www.fec.gov/data/committee/C00797670/?cycle=2026",
      "publisher": "Federal Election Commission",
      "published_at": null,
      "accessed_at": "2026-10-18",
      "kind": "primary"
    }
  ]
}
